{
  "session_id": "agt_4f21c09ab3e1",
  "agent": "claude-code",
  "generated_at": "2026-08-25T14:33:47Z",
  "resources": {
    "repositories": [
      "atlas"
    ],
    "directory_zones": [
      "workspace"
    ],
    "network_destinations": [],
    "mcp_servers": [],
    "credential_classes": [],
    "process_classes": [
      "agent",
      "git",
      "punar",
      "shell"
    ]
  },
  "security_events": [
    {
      "event_id": "evt_1787243462x7",
      "event_type": "denied_access",
      "timestamp": "2026-08-25T14:33:12Z"
    }
  ]
}
